Date exported,Query,Page,Clicks,Impressions,CTR,Average position,Intent cluster,Action,Target page,Notes
"2026-05-22","mis sold fee paying bank account","/misssold-bankaccounts.html","0","26","0%","9","bank account","Created targeted guidance + tuned title/meta","/guidance-mis-sold-packaged-bank-account-evidence.html","Highest query opportunity from export"
"2026-05-22","packaged bank account refund calculator","/misssold-bankaccounts.html","0","24","0%","10.79","bank account","Added guidance wording around refund estimates and evidence","/guidance-mis-sold-packaged-bank-account-evidence.html","Close to page one"
"2026-05-22","mis sold caravan","/holidaypark.html","0","15","0%","10.47","holiday park","Tuned title/meta/H1 for mis-sold static caravan intent","/holidaypark.html","Holiday park page already gets impressions"
"2026-05-22","gym cancellation","/gym-cancellation.html","0","101","0%","14.25","gym","Tuned title/meta and linked guidance hub article","/gym-cancellation.html","Needs CTR and position lift"
"2026-05-22","timeshare exit","/timeshare.html","0","73","0%","10.33","timeshare","Tuned title/meta and added evidence guide","/timeshare.html","Near page-one opportunity"
